{"capability":"olp.streaming-transport.v1","category":"positive","expected":{"outcome":"SUCCESS","result":{"bundle":{"closure_status":"COMPLETE","status":"VALID"},"frame_order_has_evidence_semantics":false,"transport_status":"COMPLETE"}},"id":"m24.stream.order-resource-record.001","input":{"frames":[{"record":{"content":["OLP-EVIDENCE-BUNDLE-MANIFEST",1,"portable",[[0,{"$bytes":"c69ed0f4c22fc0242da939d45448ec1fab7464fa054af334927dc0f91741cbb4"}]],[[0,{"$bytes":"c69ed0f4c22fc0242da939d45448ec1fab7464fa054af334927dc0f91741cbb4"}]],[[null,"text/plain",-16,{"$bytes":"2cf24dba5fb0a30e26e83b2ac5b9e29e1b161e5c1fa7425e73043362938b9824"}]],{},{},[]],"envelope_version":1,"extensions":{},"profiles":[],"relationships":[],"semantic_bindings":{},"type":"bundle-manifest"},"type":"manifest"},{"content_hex":"68656c6c6f","resource_ref":{"digest_hex":"2cf24dba5fb0a30e26e83b2ac5b9e29e1b161e5c1fa7425e73043362938b9824","hash_algorithm":-16,"media_type":"text/plain","resource_id":null},"type":"resource"},{"record":{"content":{"statement":"example","subject":"urn:example:subject:1"},"envelope_version":1,"extensions":{},"profiles":[],"relationships":[],"semantic_bindings":{},"type":"claim"},"type":"record"}]},"operation":"process_bundle_stream","schema":"olp-conformance-vector-v1"}
