{"capability":"olp.streaming-transport.v1","category":"positive","expected":{"outcome":"SUCCESS","result":{"cbor_item_hex":"84694f4c502d4652414d450166726573756c7483626f6b01420102","json_seq_hex":"1e7b226f6c704672616d65223a312c227061796c6f6164223a5b226f6b222c312c7b22246f6c70223a226279746573222c2276223a22415149227d5d2c2274797065223a22726573756c74227d0a"}},"id":"m24.stream.frame-wire.001","input":{"frame_type":"result","payload":["ok",1,{"$bytes":"0102"}]},"operation":"encode_stream_frame","schema":"olp-conformance-vector-v1"}
