{"schema":"olp-conformance-vector-v1","id":"m23.identity.decode.001","capability":"olp.transport-encoding.v1","category":"positive","operation":"decode_identity_text","input":{"text":"r1_AAAAAAAAAAAAAAAAAAAAAAAAAAAAAAAAAAAAAAAAAAA","expected_kind":"record"},"expected":{"outcome":"SUCCESS","result":{"kind":"record","digest_hex":"0000000000000000000000000000000000000000000000000000000000000000"}}}
