{"capability":"olp.http-api.v1","category":"positive","expected":{"outcome":"SUCCESS","result":{"forward_credentials":false,"same_origin":false,"status":"ALLOWED"}},"id":"m24.http.redirect-cross-origin-no-creds.001","input":{"credentials_present":true,"location":"https://two.example/v1/records/r1_MzMzMzMzMzMzMzMzMzMzMzMzMzMzMzMzMzMzMzMzMzM","method":"GET","original_uri":"https://one.example/v1/records/r1_MzMzMzMzMzMzMzMzMzMzMzMzMzMzMzMzMzMzMzMzMzM","requested_identity_text":"r1_MzMzMzMzMzMzMzMzMzMzMzMzMzMzMzMzMzMzMzMzMzM"},"operation":"evaluate_http_redirect","schema":"olp-conformance-vector-v1"}
