{"schema":"olp-conformance-vector-v1","id":"m23.proof.equivalence.001","capability":"olp.transport-encoding.v1","category":"positive","operation":"transport_proof_equivalence","input":{"proof":{"type":"OLPProof","version":1,"cryptosuite":"eddsa-ed25519-v1","proofPurpose":"assertion","verificationMethod":"urn:example:olp:test-key-1","recordCommitment":{"algorithm":-16,"digest_hex":"c69ed0f4c22fc0242da939d45448ec1fab7464fa054af334927dc0f91741cbb4"},"proofValue_hex":"a53978e0f7ff28583dd1d08d4f69da6684675765d299371e034f7db2f056d768c4be9bcee26e5be6b53d534f61034f3a16ea97fac421c03d96ccc7742e5ef805","critical":[],"extensions":{}}},"expected":{"outcome":"SUCCESS","result":{"proof_identity_before_hex":"02f4942b2bb0e5e4e3ae448015a17368237f7452801d0a6eaffa4efaadc853ba","proof_identity_after_json_hex":"02f4942b2bb0e5e4e3ae448015a17368237f7452801d0a6eaffa4efaadc853ba","identity_preserved":true,"proof_value_preserved":true}}}
