{
  "capability": "olp.proof.eddsa-ed25519.v1",
  "category": "unsupported",
  "description": "Unsupported commitment algorithm is classified as unsupported.",
  "expected": {
    "classification": "UNSUPPORTED",
    "outcome": "ERROR",
    "reason": "UNSUPPORTED_COMMITMENT_ALGORITHM"
  },
  "id": "proof.create.unsupported.commitment.001",
  "input": {
    "private_seed_hex": "9d61b19deffd5a60ba844af492ec2cc44449c5697b326919703bac031cae7f60",
    "proof_configuration": {
      "commitment_algorithm": -999,
      "cryptosuite": "eddsa-ed25519-v1",
      "proof_purpose": "assertion",
      "verification_method": "urn:example:olp:test-key-1"
    },
    "record": {
      "content": {
        "statement": "example",
        "subject": "urn:example:subject:1"
      },
      "envelope_version": 1,
      "type": "claim"
    }
  },
  "operation": "create_proof",
  "schema": "olp-conformance-vector-v1"
}
