{
  "capability": "olp.proof-verification.v1",
  "category": "positive",
  "description": "Valid mandatory-suite proof verifies with explicitly supplied key material.",
  "expected": {
    "outcome": "SUCCESS",
    "result": {
      "commitment_algorithm_support": "SUPPORTED",
      "conformance": "CONFORMING",
      "cryptographic_validity": "VALID",
      "cryptosuite_support": "SUPPORTED",
      "error_codes": [],
      "purpose_status": "UNDERSTOOD",
      "record_binding": "VALID",
      "verification_method_compatibility": "COMPATIBLE",
      "verification_method_resolution": "RESOLVED"
    }
  },
  "id": "proof.verify.valid.001",
  "input": {
    "proof": {
      "critical": [],
      "cryptosuite": "eddsa-ed25519-v1",
      "extensions": {},
      "proofPurpose": "assertion",
      "proofValue_hex": "a53978e0f7ff28583dd1d08d4f69da6684675765d299371e034f7db2f056d768c4be9bcee26e5be6b53d534f61034f3a16ea97fac421c03d96ccc7742e5ef805",
      "recordCommitment": {
        "algorithm": -16,
        "digest_hex": "c69ed0f4c22fc0242da939d45448ec1fab7464fa054af334927dc0f91741cbb4"
      },
      "type": "OLPProof",
      "verificationMethod": "urn:example:olp:test-key-1",
      "version": 1
    },
    "record": {
      "content": {
        "statement": "example",
        "subject": "urn:example:subject:1"
      },
      "envelope_version": 1,
      "type": "claim"
    },
    "resolved_method": {
      "identifier": "urn:example:olp:test-key-1",
      "key_type": "Ed25519",
      "provenance": "supplied",
      "public_key_hex": "d75a980182b10ab7d54bfed3c964073a0ee172f3daa62325af021a68f707511a"
    }
  },
  "operation": "verify_proof",
  "schema": "olp-conformance-vector-v1"
}
