{"capability":"olp.streaming-transport.v1","category":"unsupported","expected":{"classification":"UNSUPPORTED","outcome":"ERROR","reason":"UNSUPPORTED_STREAM_FRAME_VERSION"},"id":"m24.stream.version.001","input":{"frames":[{"record":{"content":["OLP-EVIDENCE-BUNDLE-MANIFEST",1,"portable",[[0,{"$bytes":"c69ed0f4c22fc0242da939d45448ec1fab7464fa054af334927dc0f91741cbb4"}]],[[0,{"$bytes":"c69ed0f4c22fc0242da939d45448ec1fab7464fa054af334927dc0f91741cbb4"}]],[],{},{},[]],"envelope_version":1,"extensions":{},"profiles":[],"relationships":[],"semantic_bindings":{},"type":"bundle-manifest"},"type":"manifest","version":2}]},"operation":"process_bundle_stream","schema":"olp-conformance-vector-v1"}
